{
  "$schema": "https://json-schema.org/draft/2020-12/schema",
  "$id": "urn:folderlens:filter:v2",
  "title": "FolderLens FilterSpec v1 and v2 (source directory context)",
  "type": "object",
  "additionalProperties": false,
  "required": [
    "schemaVersion",
    "rootId",
    "recursive",
    "kinds",
    "formats",
    "raw",
    "animation",
    "sort"
  ],
  "allOf": [
    {
      "if": { "properties": { "schemaVersion": { "const": 1 } } },
      "then": { "properties": { "directoryRules": { "items": { "properties": {
        "target": { "enum": ["name", "path"] }, "basePath": { "type": "null" }
      } } } } }
    },
    {
      "if": { "required": ["collectionId"], "properties": { "schemaVersion": { "const": 2 }, "collectionId": { "type": "string" } } },
      "then": { "properties": { "directoryRules": { "items": {
        "if": { "properties": { "target": { "const": "path" } } },
        "then": { "required": ["basePath"], "properties": { "basePath": { "type": "string", "minLength": 1 } } }
      } } } }
    }
  ],
  "properties": {
    "collectionId": {"type": ["string", "null"], "pattern": "^[a-fA-F0-9]{32}$", "description": "Browse this collection across catalog roots; null keeps the physical root scope."},
    "includeCollections": {"type": "array", "maxItems": 64, "uniqueItems": true, "items": {"type": "string", "pattern": "^[a-fA-F0-9]{32}$"}},
    "excludeCollections": {"type": "array", "maxItems": 64, "uniqueItems": true, "items": {"type": "string", "pattern": "^[a-fA-F0-9]{32}$"}},
    "fileExtensions": {
      "type": "array", "maxItems": 64, "uniqueItems": true,
      "items": { "type": "string", "maxLength": 255 },
      "description": "Explicit extension choices, intersected with category extensions. Empty array means unrestricted; an empty string selects files without an extension. Runtime rejects path characters and requires lowercase."
    },
    "extensions": {
      "type": "array", "maxItems": 64, "uniqueItems": true,
      "items": { "type": "string", "pattern": "^[a-z0-9][a-z0-9._+-]{0,31}$" }
    },
    "directoryRules": {
      "type": "array", "maxItems": 64,
      "items": {
        "type": "object", "additionalProperties": false,
        "required": ["action", "target", "match", "pattern"],
        "properties": {
          "action": { "enum": ["include", "exclude", "keep"] },
          "target": { "enum": ["name", "path", "sourcePath"] },
          "basePath": { "type": ["string", "null"], "description": "V2: explicitly confirmed full source root for a legacy relative path rule. Required before executing a collection path rule; never inferred from synthetic playlist roots." },
          "match": { "enum": ["equals", "contains", "startsWith", "wildcard", "regex"] },
          "pattern": { "type": "string", "minLength": 1, "maxLength": 512 },
          "includeChildren": { "type": "boolean", "default": true },
          "enabled": { "type": "boolean", "default": true }
        }
      }
    },
    "grouping": {
      "type": "object",
      "additionalProperties": false,
      "properties": {
        "enabled": { "type": "boolean", "default": false },
        "levels": { "enum": ["all", "first"], "default": "all" },
        "field": { "enum": ["name", "logicalBytes", "matchCount"], "default": "logicalBytes" },
        "direction": { "enum": ["asc", "desc"], "default": "desc" },
        "capacityScope": { "enum": ["all", "matches"], "default": "all" }
      }
    },
    "schemaVersion": {
      "enum": [1, 2]
    },
    "rootId": {
      "type": "string",
      "minLength": 1,
      "maxLength": 128
    },
    "recursive": {
      "type": "boolean"
    },
    "maxFolderLevels": {
      "type": ["integer", "null"], "minimum": 1, "maximum": 32767, "default": null,
      "description": "View-only limit relative to directoryScope: current directory is level 1; null includes all levels. Does not change scanning; ignored for virtual collections."
    },
    "directoryScope": {
      "type": "string", "maxLength": 32767, "default": "",
      "description": "Relative directory within rootId; empty means the scan root. Runtime validation rejects absolute paths, traversal, empty segments and invalid filename characters."
    },
    "scopeDirectFiles": {
      "type": "boolean", "default": false,
      "description": "Show only files directly in directoryScope without changing the recursive scan setting."
    },
    "kinds": {
      "type": "array",
      "uniqueItems": true,
      "items": {
        "enum": [
          "image",
          "video",
          "audio",
          "text",
          "markdown",
          "other"
        ]
      }
    },
    "formats": {
      "type": "array",
      "uniqueItems": true,
      "items": {
        "type": "string",
        "pattern": "^[a-z0-9][a-z0-9._+-]{0,31}$"
      }
    },
    "raw": {
      "enum": [
        "any",
        "only",
        "exclude"
      ]
    },
    "animation": {
      "enum": [
        "any",
        "static",
        "animated"
      ]
    },
    "showHidden": {
      "type": "boolean",
      "default": false
    },
    "includePending": {
      "type": "boolean",
      "description": "Compatibility name: true selects the Pending-only view; false selects confirmed Match results.",
      "default": false
    },
    "namePathQuery": {
      "type": "string",
      "maxLength": 4096
    },
    "ranges": {
      "type": "object",
      "additionalProperties": false,
      "properties": {
        "logicalBytes": {
          "$ref": "#/$defs/intRange"
        },
        "allocatedBytes": {
          "$ref": "#/$defs/intRange"
        },
        "width": {
          "$ref": "#/$defs/intRange"
        },
        "height": {
          "$ref": "#/$defs/intRange"
        },
        "longEdge": {
          "$ref": "#/$defs/intRange"
        },
        "shortEdge": {
          "$ref": "#/$defs/intRange"
        },
        "pixelCount": {
          "$ref": "#/$defs/intRange"
        },
        "durationMs": {
          "$ref": "#/$defs/intRange"
        }
      }
    },
    "aspectRatio": {
      "$ref": "#/$defs/numberRange"
    },
    "orientation": {
      "enum": [
        "any",
        "landscape",
        "portrait",
        "square"
      ]
    },
    "videoCodecs": {
      "type": "array",
      "uniqueItems": true,
      "items": {
        "type": "string",
        "minLength": 1,
        "maxLength": 64
      }
    },
    "audioCodecs": {
      "type": "array",
      "uniqueItems": true,
      "items": {
        "type": "string",
        "minLength": 1,
        "maxLength": 64
      }
    },
    "frameRate": {
      "$ref": "#/$defs/numberRange"
    },
    "dates": {
      "type": "array",
      "maxItems": 3,
      "items": {
        "type": "object",
        "additionalProperties": false,
        "required": [
          "field",
          "clock",
          "startInclusive",
          "endExclusive"
        ],
        "properties": {
          "field": {
            "enum": [
              "modified",
              "created",
              "captured"
            ]
          },
          "clock": {
            "enum": [
              "utc",
              "captureWall"
            ]
          },
          "startInclusive": {
            "type": "string",
            "minLength": 10,
            "maxLength": 40
          },
          "endExclusive": {
            "type": "string",
            "minLength": 10,
            "maxLength": 40
          }
        }
      }
    },
    "exclusions": {
      "type": "array",
      "items": {
        "type": "object",
        "additionalProperties": false,
        "required": [
          "relativePath",
          "mode"
        ],
        "properties": {
          "relativePath": {
            "type": "string",
            "minLength": 1,
            "maxLength": 32767
          },
          "mode": {
            "enum": [
              "hideView",
              "skipScan"
            ]
          }
        }
      }
    },
    "sort": {
      "type": "object",
      "additionalProperties": false,
      "required": [
        "field",
        "direction"
      ],
      "properties": {
        "field": {
          "enum": [
            "name",
            "path",
            "logicalBytes",
            "allocatedBytes",
            "modified",
            "created",
            "captured",
            "width",
            "height",
            "longEdge",
            "shortEdge",
            "pixelCount",
            "aspectRatio",
            "durationMs",
            "frameRate",
            "format"
          ]
        },
        "direction": {
          "enum": [
            "asc",
            "desc"
          ]
        },
        "nulls": {
          "const": "last",
          "default": "last"
        },
        "naturalKeyVersion": {
          "type": "integer",
          "minimum": 1
        }
      }
    },
    "searchScope": {
      "description": "Legacy compatibility field. Search always matches filenames; nameAndPath no longer enables folder or path matching.",
      "enum": [
        "name",
        "nameAndPath"
      ],
      "default": "name"
    }
  },
  "$defs": {
    "intRange": {
      "type": "object",
      "additionalProperties": false,
      "properties": {
        "min": {
          "type": "integer",
          "minimum": 0,
          "maximum": 9223372036854775807
        },
        "max": {
          "type": "integer",
          "minimum": 0,
          "maximum": 9223372036854775807
        }
      },
      "minProperties": 1
    },
    "numberRange": {
      "type": "object",
      "additionalProperties": false,
      "properties": {
        "min": {
          "type": "number",
          "minimum": 0
        },
        "max": {
          "type": "number",
          "minimum": 0
        }
      },
      "minProperties": 1
    }
  }
}
